{
  "annotation_id": "ann_fam_0014_ADJ",
  "target_type": "query_family",
  "target_id": "fam_0014",
  "annotator_id": "adjudicator_J",
  "pass_type": "adjudication",
  "blind": false,
  "adjudicates": [
    "ann_fam_0014_A1",
    "ann_fam_0014_A2"
  ],
  "recorded_at": "2026-07-21T09:00:00",
  "labels": {
    "present_absent": "absent",
    "atom_states": [
      {
        "atom_id": "a1",
        "state": "contradicted"
      }
    ]
  },
  "synthetic": true
}
