{
  "annotation_id": "ann_fam_0014_A2",
  "target_type": "query_family",
  "target_id": "fam_0014",
  "annotator_id": "annotator_A2",
  "pass_type": "independent",
  "blind": true,
  "recorded_at": "2026-07-20T10:05:00",
  "labels": {
    "present_absent": "absent",
    "atom_states": [
      {
        "atom_id": "a1",
        "state": "contradicted"
      }
    ]
  },
  "synthetic": true
}
