{
  "annotation_id": "ann_fam_0011_ADJ",
  "target_type": "query_family",
  "target_id": "fam_0011",
  "annotator_id": "adjudicator_J",
  "pass_type": "adjudication",
  "blind": false,
  "adjudicates": [
    "ann_fam_0011_A1",
    "ann_fam_0011_A2"
  ],
  "recorded_at": "2026-07-21T09:00:00",
  "labels": {
    "present_absent": "present",
    "atom_states": [
      {
        "atom_id": "a1",
        "state": "supported"
      }
    ],
    "temporal_boundaries": [
      {
        "t0": 40.0,
        "t1": 120.0
      }
    ]
  },
  "synthetic": true
}
