{
  "annotation_id": "ann_fam_0022_ADJ",
  "target_type": "query_family",
  "target_id": "fam_0022",
  "annotator_id": "adjudicator_J",
  "pass_type": "adjudication",
  "blind": false,
  "adjudicates": [
    "ann_fam_0022_A1",
    "ann_fam_0022_A2"
  ],
  "recorded_at": "2026-07-21T09:00:00",
  "labels": {
    "present_absent": "absent"
  },
  "synthetic": true
}
